{
  "id": "is-svg-CVE-2021-28092",
  "name": "is-svg",
  "type": "cve",
  "cve": "CVE-2021-28092",
  "ghsa": "GHSA-7r28-3m3f-r2pr",
  "cwe": "CWE-1333",
  "ecosystem": "npm",
  "package": "is-svg",
  "affected": ">=2.1.0 <4.3.0",
  "patched": "4.3.0",
  "published": "2021-03-12",
  "discovered_by": "Yeting Li",
  "regex": "^\\s*(?:<\\?xml[^>]*>\\s*)?(?:<!doctype svg[^>]*\\s*(?:\\[?(?:\\s*<![^>]*>\\s*)*\\]?)*[^>]*>\\s*)?(?:<svg[^>]*>[^]*<\\/svg>|<svg[^\\/>]*\\/\\s*>)\\s*$",
  "flags": "i",
  "complexity": "exponential",
  "attack": {
    "prefix": "<!doctype svg ",
    "pad": "<!x>",
    "suffix": ""
  },
  "benign": "<svg></svg>",
  "fix": {
    "type": "regex-rewrite",
    "summary": "The DOCTYPE sub-pattern (?:\\[?(?:\\s*<![^>]*>\\s*)*\\]?)* nests two unbounded quantifiers, giving exponential backtracking on repeated internal-subset declarations. is-svg 4.3.0 replaced the check with a non-backtracking approach.",
    "commit": "https://github.com/sindresorhus/is-svg/releases/tag/v4.3.0"
  },
  "description": "is-svg reports whether a string is an SVG document and is used by cssnano / SVG optimisation pipelines. A crafted DOCTYPE with many internal declarations triggers exponential backtracking.",
  "references": [
    "https://nvd.nist.gov/vuln/detail/CVE-2021-28092",
    "https://github.com/advisories/GHSA-7r28-3m3f-r2pr"
  ]
}
