{
  "id": "postcss-CVE-2021-23368",
  "name": "postcss",
  "type": "cve",
  "cve": "CVE-2021-23368",
  "ghsa": "GHSA-hwj9-h5mp-3pm3",
  "cwe": "CWE-400",
  "ecosystem": "npm",
  "engine": "javascript",
  "package": "postcss",
  "affected": ">=7.0.0 <7.0.36 || >=8.0.0 <8.2.10",
  "patched": "8.2.10",
  "published": "2021-05-10",
  "discovered_by": "Anas Elha; reported via GitHub advisory",
  "regex": "\\/\\*\\s*# sourceMappingURL=(.*)\\s*\\*\\/",
  "flags": "",
  "complexity": "quadratic",
  "attack": {
    "prefix": "/*# sourceMappingURL=",
    "pad": " ",
    "suffix": "!"
  },
  "benign": "/*# sourceMappingURL=data:app.map */",
  "fix": {
    "type": "regex-rewrite",
    "summary": "postcss parsed inline source-map annotations in `lib/previous-map.js` with `/\\/\\*\\s*# sourceMappingURL=(.*)\\s*\\*\\//`. The greedy `(.*)` and the adjacent `\\s*` both match whitespace, so on a comment whose sourceMappingURL is followed by a long run of whitespace that never reaches the closing `*/`, the two overlapping quantifiers split the whitespace run ambiguously and the engine retries every partition before failing: O(n^2). postcss 8.2.10 (and 7.0.36) removed the overlapping `\\s*` (regex becomes `(.*)\\*\\/`) and trims the captured URL in code with `.trim()`, eliminating the ambiguous split.",
    "commit": "https://github.com/postcss/postcss/commit/8682b1e4e328432ba692bed52326e84439cec9e4"
  },
  "description": "postcss is the CSS transformation engine underlying Autoprefixer, Tailwind, cssnano and most modern front-end build toolchains, making it one of the most-installed packages in the npm ecosystem. When reading a stylesheet's inline source-map annotation, it used the regex `/\\/\\*\\s*# sourceMappingURL=(.*)\\s*\\*\\//`. Because the greedy `(.*)` capture and the following `\\s*` both consume whitespace, a crafted CSS comment of the form `/*# sourceMappingURL=` followed by a long whitespace run with no terminating `*/` causes quadratic backtracking as the engine tries every way to divide the whitespace between the two quantifiers.",
  "references": [
    "https://nvd.nist.gov/vuln/detail/CVE-2021-23368",
    "https://github.com/advisories/GHSA-hwj9-h5mp-3pm3",
    "https://github.com/postcss/postcss/commit/8682b1e4e328432ba692bed52326e84439cec9e4"
  ]
}
