{
  "id": "glob-parent-CVE-2020-28469",
  "name": "glob-parent",
  "type": "cve",
  "cve": "CVE-2020-28469",
  "ghsa": "GHSA-ww39-953v-wcq6",
  "cwe": "CWE-1333",
  "ecosystem": "npm",
  "engine": "javascript",
  "package": "glob-parent",
  "affected": "<5.1.2",
  "patched": "5.1.2",
  "published": "2021-06-03",
  "discovered_by": "Yeting Li",
  "regex": "[\\{\\[].*[\\/]*.*[\\}\\]]$",
  "flags": "",
  "complexity": "quadratic",
  "attack": {
    "prefix": "{",
    "pad": "a",
    "suffix": "!"
  },
  "benign": "{foo/bar}",
  "fix": {
    "type": "regex-rewrite",
    "summary": "The enclosure test regex contained two adjacent unbounded groups `.*[\\/]*.*` around an optional `[\\/]*` that can match empty, so a long run of non-bracket characters could be partitioned many ways before the trailing `[\\}\\]]$` fails. glob-parent 5.1.2 collapsed it to a single `.*` (`/[\\{\\[].*[\\}\\]]$/`), removing the ambiguity.",
    "commit": "https://github.com/gulpjs/glob-parent/commit/c6db86422a9731d4f3d332ce4a81c27ea6b0ee46"
  },
  "description": "glob-parent extracts the non-magic parent path from a glob and is a transitive dependency of chokidar, fast-glob and much of the JS build/watch tool-chain (tens of millions of weekly downloads). Its enclosure detection regex backtracks quadratically on a string that opens a brace/bracket enclosure followed by a long run of characters with no closing bracket.",
  "references": [
    "https://nvd.nist.gov/vuln/detail/CVE-2020-28469",
    "https://github.com/advisories/GHSA-ww39-953v-wcq6",
    "https://github.com/gulpjs/glob-parent/pull/36"
  ]
}
