{
  "id": "django-CVE-2019-14232",
  "name": "Django (Truncator / truncatewords_html)",
  "type": "cve",
  "cve": "CVE-2019-14232",
  "ghsa": "GHSA-c4qh-4vgv-qc6g",
  "cwe": "CWE-400",
  "ecosystem": "pypi",
  "engine": "python",
  "package": "Django",
  "affected": "<1.11.23 || >=2.1 <2.1.11 || >=2.2 <2.2.4",
  "patched": "2.2.4",
  "published": "2019-08-01",
  "discovered_by": "Guido Vranken",
  "regex": "<.*?>|((?:\\w[-\\w]*|&.*?;)+)",
  "flags": "s",
  "complexity": "quadratic",
  "attack": {
    "prefix": "",
    "pad": "&",
    "suffix": ""
  },
  "benign": "The quick brown fox <b>jumps</b> over the lazy dog.",
  "fix": {
    "type": "regex-rewrite",
    "summary": "django.utils.text.Truncator used `re_words = <.*?>|((?:\\w[-\\w]*|&.*?;)+)` to walk HTML while truncating (used by the `truncatewords_html` / `truncatechars_html` template filters). The second branch of the capturing group, `&.*?;`, is a lazy HTML-entity matcher; on a long run of `&` characters with no terminating `;`, the outer `+` can partition that run in quadratically many ways while `.*?` repeatedly scans forward for a `;` that never arrives, so backtracking blows up. The fix replaces the ambiguous alternation with a single non-overlapping character class, `re_words = <[^>]+?>|([^<>\\s]+)`, which matches the same word/entity runs in one unambiguous pass.",
    "patched_regex": "<[^>]+?>|([^<>\\s]+)",
    "commit": "https://github.com/django/django/commit/7f65974f8219"
  },
  "description": "Django is the most widely used Python web framework. The `truncatewords_html` and `truncatechars_html` template filters (via `django.utils.text.Truncator`) run this regex over user-visible HTML to truncate it while preserving tags. If an attacker can get attacker-controlled text containing a long run of ampersands rendered through one of these filters, the regex exhibits catastrophic backtracking and hangs the worker, a denial of service. Fixed in Django 1.11.23, 2.1.11 and 2.2.4.",
  "references": [
    "https://nvd.nist.gov/vuln/detail/CVE-2019-14232",
    "https://github.com/advisories/GHSA-c4qh-4vgv-qc6g",
    "https://www.djangoproject.com/weblog/2019/aug/01/security-releases/",
    "https://github.com/django/django/commit/7f65974f8219"
  ]
}
