{
  "id": "http-cache-semantics-CVE-2022-25881",
  "name": "http-cache-semantics",
  "type": "cve",
  "cve": "CVE-2022-25881",
  "ghsa": "GHSA-rc47-6667-2j5j",
  "cwe": "CWE-1333",
  "ecosystem": "npm",
  "engine": "javascript",
  "package": "http-cache-semantics",
  "affected": "<4.1.1",
  "patched": "4.1.1",
  "published": "2023-01-31",
  "discovered_by": "reported via GitHub advisory GHSA-rc47-6667-2j5j",
  "regex": "\\s*,\\s*",
  "flags": "",
  "complexity": "quadratic",
  "attack": {
    "prefix": "",
    "pad": " ",
    "suffix": "!"
  },
  "benign": "max-age=600, no-cache",
  "fix": {
    "type": "regex-rewrite",
    "summary": "`parseCacheControl` in index.js split the incoming Cache-Control (and similar) header with `header.trim().split(/\\s*,\\s*/)` and each directive with `part.split(/\\s*=\\s*/, 2)`. Both split regexes surround the delimiter with a greedy `\\s*` on either side, so a header value that is a long run of whitespace containing no delimiter forces the engine, at every start offset, to greedily consume the remaining whitespace, fail to find `,` (or `=`), and backtrack one space at a time before giving up and advancing: O(n^2). http-cache-semantics 4.1.1 replaced the patterns with the delimiter-only `split(/,/)` and `split(/=/, 2)` and moved whitespace trimming into code with `.trim()`, removing the backtrackable `\\s*` and making parsing linear (fix commit 560b2d8ef452 \"Don't use regex to trim whitespace\").",
    "commit": "https://github.com/kornelski/http-cache-semantics/commit/560b2d8ef4520b6c1dbb51f6f8bab53f2948540c"
  },
  "description": "http-cache-semantics is an extremely widely-installed npm package that implements RFC 7234 HTTP caching rules; it is a transitive dependency of many HTTP clients and caching layers (e.g. via `got`, `make-fetch-happen`, `cacheable-request`). Its `parseCacheControl` helper parsed the `Cache-Control` header by splitting on `/\\s*,\\s*/` and each directive on `/\\s*=\\s*/`. Because both split patterns wrap the delimiter with a greedy `\\s*`, a header consisting of a long whitespace run with no comma (or no `=`) makes the regex engine, starting at each of the O(n) positions, greedily consume the trailing whitespace, fail the delimiter, and backtrack one character at a time: quadratic O(n^2) blow-up. Since request/response headers are attacker-influenced, a maliciously crafted Cache-Control header is a denial-of-service vector against any server or client that parses it. http-cache-semantics 4.1.1 rewrote the split patterns to match the bare delimiter (`/,/`, `/=/`) and trim whitespace in code with `.trim()`, eliminating the backtracking.",
  "references": [
    "https://nvd.nist.gov/vuln/detail/CVE-2022-25881",
    "https://github.com/advisories/GHSA-rc47-6667-2j5j",
    "https://github.com/kornelski/http-cache-semantics/commit/560b2d8ef4520b6c1dbb51f6f8bab53f2948540c"
  ]
}
