{
  "id": "hosted-git-info-CVE-2021-23362",
  "name": "hosted-git-info",
  "type": "cve",
  "cve": "CVE-2021-23362",
  "ghsa": "GHSA-43f8-2h32-f4cj",
  "cwe": "CWE-1333",
  "ecosystem": "npm",
  "engine": "javascript",
  "package": "hosted-git-info",
  "affected": "<2.8.9",
  "patched": "2.8.9",
  "published": "2021-05-06",
  "discovered_by": "Yeting Li",
  "regex": "^([^:]+):(?:(?:[^@:]+(?:[^@]+)?@)?([^/]*))[/](.+?)(?:[.]git)?($|#)",
  "flags": "",
  "complexity": "quadratic",
  "attack": {
    "prefix": "a:",
    "pad": "a",
    "suffix": "!"
  },
  "benign": "github:user/project",
  "fix": {
    "type": "regex-rewrite",
    "summary": "The shortcut parser nested two overlapping unbounded groups `[^@:]+(?:[^@]+)?` inside an optional `@` group, so a shortcut-style URL with a long run of characters that never reaches an `@` or `/` could be partitioned many ways before the mandatory `[/]` fails, giving quadratic backtracking. hosted-git-info 2.8.9 rewrote the regex to `^([^:]+):(?:[^@]+@)?(?:([^/]*)\\/)?([^#]+)`, replacing the ambiguous nesting with a single non-overlapping `[^@]+@` and an optional path group.",
    "commit": "https://github.com/npm/hosted-git-info/commit/bede0dc38e1785e732bf0a48ba6f81a4a908eba3"
  },
  "description": "hosted-git-info parses shorthand and URL references to git hosts and is an extremely common transitive dependency (used by npm itself via normalize-package-data, and by countless build tools). Its shortcut-URL matcher backtracks quadratically on a shortcut-style string whose authority section is a long run of non-`@`, non-`/` characters that never satisfies the trailing path separator.",
  "references": [
    "https://nvd.nist.gov/vuln/detail/CVE-2021-23362",
    "https://github.com/advisories/GHSA-43f8-2h32-f4cj",
    "https://github.com/npm/hosted-git-info/pull/76"
  ]
}
