{
  "id": "nth-check-CVE-2021-3803",
  "name": "nth-check",
  "type": "cve",
  "cve": "CVE-2021-3803",
  "ghsa": "GHSA-rp65-9cf3-cjxr",
  "cwe": "CWE-1333",
  "ecosystem": "npm",
  "package": "nth-check",
  "affected": "<2.0.1",
  "patched": "2.0.1",
  "published": "2021-09-17",
  "discovered_by": "Yeting Li",
  "regex": "^([+\\-]?\\d*n)?\\s*(?:([+\\-]?)\\s*(\\d+))?$",
  "flags": "",
  "complexity": "quadratic",
  "attack": {
    "prefix": "",
    "pad": " ",
    "suffix": "!"
  },
  "benign": "2n+1",
  "fix": {
    "type": "regex-rewrite",
    "summary": "Two \\s* groups separated by an optional ([+-]?) that can match empty let a whitespace run be split two ways. nth-check 2.0.1 restructured parsing to avoid the overlapping optional whitespace.",
    "commit": "https://github.com/fb55/nth-check/security/advisories/GHSA-rp65-9cf3-cjxr"
  },
  "description": "nth-check parses CSS :nth-child()-style formulas and is a transitive dependency of svgo, css-select and much of the front-end build tool-chain. A crafted formula of whitespace triggers quadratic backtracking.",
  "references": [
    "https://nvd.nist.gov/vuln/detail/CVE-2021-3803",
    "https://github.com/advisories/GHSA-rp65-9cf3-cjxr"
  ]
}
