{
  "id": "sqlparse-CVE-2021-32839",
  "name": "python-sqlparse (StripComments)",
  "type": "cve",
  "cve": "CVE-2021-32839",
  "ghsa": "GHSA-p5w8-wqhj-9hhf",
  "cwe": "CWE-1333",
  "ecosystem": "pypi",
  "engine": "python",
  "package": "sqlparse",
  "affected": ">=0.4.0 <0.4.2",
  "patched": "0.4.2",
  "published": "2021-09-20",
  "discovered_by": "GitHub Security Lab (GHSL-2021-107)",
  "regex": "((\\r\\n|\\r|\\n)+) *$",
  "flags": "",
  "complexity": "exponential",
  "attack": {
    "prefix": "",
    "pad": "\r\n",
    "suffix": "\t"
  },
  "benign": "\r\n\r\n  ",
  "fix": {
    "type": "regex-rewrite",
    "summary": "The `_get_insert_token` helper of the StripComments filter used `((\\r\\n|\\r|\\n)+) *$` to preserve trailing line breaks when removing a comment. The inner alternation lets a run of CRLF be split two ways (`\\r\\n` as one token, or `\\r` then `\\n`), so a long run of CRLF followed by a non-space, non-newline character (which fails the trailing ` *$`) forces exponential backtracking. The fix drops the redundant `\\r\\n` alternative, leaving `((\\r|\\n)+) *$`, which matches the same line-break runs unambiguously.",
    "patched_regex": "((\\r|\\n)+) *$",
    "commit": "https://github.com/andialbrecht/sqlparse/commit/8238a9e"
  },
  "description": "sqlparse is a widely used non-validating SQL parser for Python. When `sqlparse.format(sql, strip_comments=True)` (or the `sqlformat --strip-comments` CLI) removes a comment, it runs this regex over the comment text to preserve trailing newlines. A SQL comment whose body is a long run of CRLF pairs followed by a tab triggers catastrophic backtracking, letting an attacker who controls formatted SQL hang the process.",
  "references": [
    "https://nvd.nist.gov/vuln/detail/CVE-2021-32839",
    "https://github.com/advisories/GHSA-p5w8-wqhj-9hhf",
    "https://securitylab.github.com/advisories/GHSL-2021-107-andialbrecht-sqlparse/",
    "https://github.com/andialbrecht/sqlparse/commit/8238a9e"
  ]
}
