{
  "id": "moment-CVE-2016-4055",
  "name": "moment",
  "type": "cve",
  "cve": "CVE-2016-4055",
  "ghsa": "GHSA-87vv-r9j6-g5qv",
  "cwe": "CWE-1333",
  "ecosystem": "npm",
  "engine": "javascript",
  "package": "moment",
  "affected": "<2.11.2",
  "patched": "2.11.2",
  "published": "2016-04-13",
  "discovered_by": "Rod Vagg",
  "regex": "(\\-)?(?:(\\d*)[. ])?(\\d+)\\:(\\d+)(?:\\:(\\d+)\\.?(\\d{3})?)?",
  "flags": "",
  "complexity": "quadratic",
  "attack": {
    "prefix": "",
    "pad": "1",
    "suffix": "!"
  },
  "benign": "23:59:59",
  "fix": {
    "type": "regex-rewrite",
    "summary": "The unanchored ASP.NET-style duration regex used by moment.duration() has an optional `(\\d*)[. ]` group followed by `(\\d+)\\:`; on a long run of digits with no colon the engine could partition the digits between `(\\d*)` and `(\\d+)` many ways, and because the pattern is unanchored it re-tries this match at every starting offset before failing, giving quadratic blow-up. moment 2.11.2 anchored the pattern with `^...$` (and appended `\\d*`) so a non-matching input fails once instead of being re-scanned from every position.",
    "commit": "https://github.com/moment/moment/commit/34af63b8b21208a949dfaf42d228502c73d20ec0"
  },
  "description": "moment is one of the most-downloaded date/time libraries in the npm ecosystem. Its moment.duration() parser matches ASP.NET-style time strings with an unanchored regex that backtracks quadratically on a long run of digits without a colon, so untrusted duration input can hang the event loop.",
  "references": [
    "https://nvd.nist.gov/vuln/detail/CVE-2016-4055",
    "https://github.com/advisories/GHSA-87vv-r9j6-g5qv",
    "https://github.com/moment/moment/pull/2939"
  ]
}
