{
  "id": "ms-CVE-2015-8315",
  "name": "ms (millisecond duration parser)",
  "type": "cve",
  "cve": "CVE-2015-8315",
  "ghsa": "GHSA-3fx5-fwvr-xrjg",
  "cwe": "CWE-1333",
  "ecosystem": "npm",
  "engine": "javascript",
  "package": "ms",
  "affected": "<0.7.1",
  "patched": "0.7.1",
  "published": "2016-04-20",
  "discovered_by": "Adam Baldwin (@evilpacket)",
  "regex": "^((?:\\d+)?\\.?\\d+) *(milliseconds?|msecs?|ms|seconds?|secs?|s|minutes?|mins?|m|hours?|hrs?|h|days?|d|years?|yrs?|y)?$",
  "flags": "i",
  "complexity": "quadratic",
  "attack": {
    "prefix": "5",
    "pad": "5",
    "suffix": "!"
  },
  "benign": "100 days",
  "fix": {
    "type": "input-limit",
    "summary": "The vulnerable regex was NOT changed. ms 0.7.1 added a single input-length guard at the top of parse(): `str = '' + str; if (str.length > 10000) return;`. This caps how far the quadratic backtracking can run rather than removing it — a string of exactly 10000 digits can still take ~1s. Later releases (0.7.3 lowered the cap to 100 chars) tightened the bound further, but the underlying regex ambiguity `(?:\\d+)?\\.?\\d+` remains. A useful lesson: many real-world ReDoS 'fixes' are input-size caps, not regex rewrites.",
    "patched_regex": null,
    "commit": "https://github.com/vercel/ms/commit/48701f029417faf65e6f5e0b61a3cebe5436b07b"
  },
  "description": "ms is one of the most-downloaded npm packages ever (a transitive dependency of debug, express and much of the ecosystem). Its string parser turns human durations like `2 days` or `100ms` into milliseconds. The leading `(?:\\d+)?\\.?\\d+` lets a run of digits be split ambiguously between the optional `(?:\\d+)?` group and the mandatory `\\d+`; when the string is a long digit run followed by a character the unit alternation and end-anchor reject, the engine retries every split, giving quadratic-time backtracking. Any code that passes an untrusted string to ms() (parsing a config value, a header, a query parameter) can be stalled.",
  "references": [
    "https://nvd.nist.gov/vuln/detail/CVE-2015-8315",
    "https://github.com/advisories/GHSA-3fx5-fwvr-xrjg",
    "https://github.com/vercel/ms/commit/48701f029417faf65e6f5e0b61a3cebe5436b07b"
  ]
}
