{
  "id": "normalize-url-CVE-2021-33502",
  "name": "normalize-url",
  "type": "cve",
  "cve": "CVE-2021-33502",
  "ghsa": "GHSA-px4h-xg32-q955",
  "cwe": "CWE-400",
  "ecosystem": "npm",
  "engine": "javascript",
  "package": "normalize-url",
  "affected": ">=4.3.0 <4.5.1 || >=5.0.0 <5.3.1 || >=6.0.0 <6.0.1",
  "patched": "6.0.1",
  "published": "2021-06-08",
  "discovered_by": "reported via GitHub advisory GHSA-px4h-xg32-q955",
  "regex": "^data:(?<type>.*?),(?<data>.*?)(?:#(?<hash>.*))?$",
  "flags": "",
  "complexity": "quadratic",
  "attack": {
    "prefix": "data:,",
    "pad": "#",
    "suffix": "\n"
  },
  "benign": "data:text/plain;base64,SGVsbG8=",
  "fix": {
    "type": "regex-rewrite",
    "summary": "normalize-url parsed `data:` URLs in `index.js` with `/^data:(?<type>.*?),(?<data>.*?)(?:#(?<hash>.*))?$/`. Both the `type` and `data` groups are lazy `.*?`, and `data` overlaps with the optional greedy `#(?<hash>.*)` group. On a data URL whose body is a long run of `#` characters that the trailing anchor can never satisfy (`.` does not cross the newline that blocks `$`), the engine tries every way to divide the run between `data` and `hash` before failing: O(n^2). normalize-url 6.0.1 (and 5.3.1 / 4.5.1) rewrote the groups to negated character classes `(?<type>[^,]*?)` and `(?<data>[^#]*?)`, so each group is bounded by the next required delimiter and the ambiguous split disappears.",
    "commit": "https://github.com/sindresorhus/normalize-url/commit/b1fdb5120b6d27a88400d8800e67ff5a22bd2103"
  },
  "description": "normalize-url is a very widely-installed URL-normalization utility (a transitive dependency of many build tools, crawlers and link-processing packages). When it detected a `data:` URL it parsed the components with the regex `/^data:(?<type>.*?),(?<data>.*?)(?:#(?<hash>.*))?$/`. Because both capture groups are lazy `.*?` and the `data` group overlaps with the optional `#(?<hash>.*)` hash group, a crafted data URL of the form `data:,` followed by a long run of `#` characters causes quadratic backtracking as the engine tries every partition of the run between the `data` and `hash` groups before the anchored match fails. The fix replaces the greedy dot-star groups with delimiter-bounded negated classes.",
  "references": [
    "https://nvd.nist.gov/vuln/detail/CVE-2021-33502",
    "https://github.com/advisories/GHSA-px4h-xg32-q955",
    "https://github.com/sindresorhus/normalize-url/commit/b1fdb5120b6d27a88400d8800e67ff5a22bd2103"
  ]
}
