{
  "id": "micromatch-CVE-2024-4067",
  "name": "micromatch",
  "type": "cve",
  "cve": "CVE-2024-4067",
  "ghsa": "GHSA-952p-6rrq-rcjv",
  "cwe": "CWE-1333",
  "ecosystem": "npm",
  "engine": "javascript",
  "package": "micromatch",
  "affected": "<4.0.8",
  "patched": "4.0.8",
  "published": "2024-05-14",
  "discovered_by": "reported via GitHub advisory GHSA-952p-6rrq-rcjv (micromatch issue #243)",
  "regex": "\\{.*\\}",
  "flags": "",
  "complexity": "quadratic",
  "attack": {
    "prefix": "",
    "pad": "{",
    "suffix": ""
  },
  "benign": "{a,b,c}",
  "fix": {
    "type": "algorithm-change",
    "summary": "Before expanding braces, `micromatch.braces()` decided whether a pattern contained a brace expression with `/\\{.*\\}/.test(pattern)`. The regex `\\{.*\\}` is unanchored, so on a pattern made of a long run of `{` characters (with no closing `}`) the engine starts a match at every `{` offset, has `.*` greedily consume the rest of the string, then backtracks looking for a `}` that never appears and fails — repeating that O(n) scan from each of the O(n) start positions: quadratic O(n^2). micromatch 4.0.8 replaced the regex test with a linear `hasBraces()` helper that uses two `indexOf` calls (`v.indexOf('{')` then `v.indexOf('}', index)`), removing the backtracking scan entirely.",
    "commit": "https://github.com/micromatch/micromatch/commit/03aa8052171e878897eee5d7bb2ae0ae83ec2ade"
  },
  "description": "micromatch is one of the most-depended-upon packages on npm (a core glob-matching utility used by anymatch, chokidar, fast-glob and much of the JavaScript build/watch toolchain). To decide whether a glob pattern needs brace expansion, `micromatch.braces()` ran `/\\{.*\\}/.test(pattern)`. Because the pattern is not anchored at the start of the string, a pattern consisting of a long run of `{` characters forces the engine to try the match from every `{` offset; at each offset the greedy `.*` consumes the remainder of the string and then backtracks looking for a `}` that is never found, so each of the O(n) start positions performs an O(n) scan — quadratic O(n^2) blow-up. Since glob patterns are frequently derived from user or config input, this is a denial-of-service vector. micromatch 4.0.8 replaced the regex probe with a backtracking-free `hasBraces()` helper built from `String.prototype.indexOf`.",
  "references": [
    "https://nvd.nist.gov/vuln/detail/CVE-2024-4067",
    "https://github.com/advisories/GHSA-952p-6rrq-rcjv",
    "https://github.com/micromatch/micromatch/issues/243",
    "https://github.com/micromatch/micromatch/pull/266",
    "https://github.com/micromatch/micromatch/commit/03aa8052171e878897eee5d7bb2ae0ae83ec2ade"
  ]
}
