{
  "id": "loader-utils-CVE-2022-37603",
  "name": "loader-utils",
  "type": "cve",
  "cve": "CVE-2022-37603",
  "ghsa": "GHSA-3rfm-jhwj-7488",
  "cwe": "CWE-1333",
  "ecosystem": "npm",
  "engine": "javascript",
  "package": "loader-utils",
  "affected": ">=1.0.0 <1.4.2 || >=2.0.0 <2.0.4 || >=3.0.0 <3.2.1",
  "patched": "1.4.2",
  "published": "2022-10-14",
  "discovered_by": "reported via GitHub advisory GHSA-3rfm-jhwj-7488",
  "regex": "\\[(?:([^:\\]]+):)?(?:hash|contenthash)(?::([a-z]+\\d*))?(?::(\\d+))?\\]",
  "flags": "gi",
  "complexity": "quadratic",
  "attack": {
    "prefix": "",
    "pad": "[hash",
    "suffix": ""
  },
  "benign": "[name].[contenthash:8].[ext]",
  "fix": {
    "type": "regex-rewrite",
    "summary": "loader-utils' `interpolateName` used the regex `/\\[(?:([^:\\]]+):)?(?:hash|contenthash)(?::([a-z]+\\d*))?(?::(\\d+))?\\]/gi` to find `[hash]`/`[contenthash]` template tokens in a resource name. The optional leading group `([^:\\]]+)` matched any character except `:` and `]` — crucially it also matched `[`, so on a run of `[hash[hash[hash...` the group greedily consumed the tail across every `[` boundary, failed the following `:` and the `hash|contenthash` literal, and backtracked; because the pattern is global (`g`) and unanchored, the engine retried this greedy-consume-and-backtrack from each of the O(n) `[` start positions, giving quadratic O(n^2) blow-up. loader-utils 1.4.2 / 2.0.4 / 3.2.1 fixed it by adding `[` to the excluded character class — `([^[:\\]]+)` — so the group stops at each `[` and the total work is bounded to linear.",
    "commit": "https://github.com/webpack/loader-utils/commit/d2d752d59629daee38f34b24307221349c490eb1"
  },
  "description": "loader-utils is a core utility package of the webpack ecosystem (used by countless webpack loaders to build output file names from templates), with tens of millions of weekly downloads. Its `interpolateName` helper expands `[hash]`/`[contenthash]` tokens using the regex `/\\[(?:([^:\\]]+):)?(?:hash|contenthash)(?::([a-z]+\\d*))?(?::(\\d+))?\\]/gi`. The optional group `([^:\\]]+)` excludes only `:` and `]`, so it also matches the `[` character. Against a resource name (or template) containing a long run such as `[hash[hash[hash...`, the group greedily consumes the run across bracket boundaries, fails the required `:` and the `hash`/`contenthash` literal, and backtracks; since the regex is global and unanchored, it repeats this from every `[` start offset, producing quadratic O(n^2) time. Because file names can be attacker-influenced (for example a crafted resourcePath or query), this is a denial-of-service vector. The fix (loader-utils 1.4.2, 2.0.4 and 3.2.1) simply added `[` to the excluded set — `([^[:\\]]+)` — bounding the scan to linear time.",
  "references": [
    "https://nvd.nist.gov/vuln/detail/CVE-2022-37603",
    "https://github.com/advisories/GHSA-3rfm-jhwj-7488",
    "https://github.com/webpack/loader-utils/issues/216",
    "https://github.com/webpack/loader-utils/commit/d2d752d59629daee38f34b24307221349c490eb1"
  ]
}