{
  "id": "marked-CVE-2022-21681",
  "name": "marked",
  "type": "cve",
  "cve": "CVE-2022-21681",
  "ghsa": "GHSA-5v2h-r2cx-5xgj",
  "cwe": "CWE-1333",
  "ecosystem": "npm",
  "package": "marked",
  "affected": "<4.0.10",
  "patched": "4.0.10",
  "published": "2022-01-14",
  "discovered_by": "Wenzhuo Bill Zhang, Cornell University",
  "regex": "!?\\[((?:\\[(?:\\\\.|[^\\[\\]\\\\])*\\]|\\\\.|`[^`]*`|[^\\[\\]\\\\`])*?)\\]\\[(?!\\s*\\])((?:\\\\[\\[\\]]?|[^\\[\\]\\\\])+)\\]|!?\\[(?!\\s*\\])((?:\\[[^\\[\\]]*\\]|\\\\[\\[\\]]|[^\\[\\]])*)\\](?:\\[\\])?(?!\\()",
  "flags": "",
  "complexity": "quadratic",
  "attack": {
    "prefix": "",
    "pad": "\\[",
    "suffix": ""
  },
  "benign": "[text][ref]",
  "fix": {
    "type": "regex-rewrite",
    "summary": "The reflink-search regex nests a lazy outer group over an alternation whose branches (an escaped char and a non-bracket run) both match a backslash-then-bracket sequence, so a long run of \\[ tokens can be partitioned across the group in quadratically many ways before the \\]\\[ tail fails to match. marked 4.0.10 bounds and simplifies the inline reflink/nolink search grammar.",
    "commit": "https://github.com/markedjs/marked/commit/8f806573a3f6c6b7a39b8cdb66ab5ebb8d55a5f5"
  },
  "description": "marked is a widely-used Markdown parser and compiler. When marked parses attacker-supplied Markdown, the inline reflink-search grammar backtracks quadratically on a long run of escaped-bracket (\\[) sequences, stalling the event loop (a denial of service for any server that renders untrusted Markdown).",
  "references": [
    "https://nvd.nist.gov/vuln/detail/CVE-2022-21681",
    "https://github.com/advisories/GHSA-5v2h-r2cx-5xgj",
    "https://github.com/markedjs/marked/security/advisories/GHSA-5v2h-r2cx-5xgj"
  ]
}
