{
  "id": "ansi-regex-CVE-2021-3807",
  "name": "ansi-regex",
  "type": "cve",
  "cve": "CVE-2021-3807",
  "ghsa": "GHSA-93q8-gq69-wqmw",
  "cwe": "CWE-1333",
  "ecosystem": "npm",
  "package": "ansi-regex",
  "affected": "<3.0.1 || >=4.0.0 <4.1.1 || >=5.0.0 <5.0.1 || >=6.0.0 <6.0.1",
  "patched": "5.0.1",
  "published": "2021-09-17",
  "discovered_by": "Yeting Li",
  "regex": "[\\u001B\\u009B][[\\]()#;?]*(?:(?:(?:[a-zA-Z\\d]*(?:;[-a-zA-Z\\d\\/#&.:=?%@~_]*)*)?\\u0007)|(?:(?:\\d{1,4}(?:;\\d{0,4})*)?[\\dA-PR-TZcf-ntqry=><~]))",
  "flags": "",
  "complexity": "quadratic",
  "attack": {
    "prefix": "\u001b[",
    "pad": ";",
    "suffix": ""
  },
  "benign": "\u001b[31m",
  "fix": {
    "type": "regex-rewrite",
    "summary": "The ANSI matcher overlapped the character class [[\\]()#;?]* with the alternation (?:;...)*, so a long run of \";\" could be partitioned two ways (quadratic). The fix constrained the sub-patterns to remove the ambiguity.",
    "commit": "https://github.com/chalk/ansi-regex/commit/8d1d7cdb586269882c4bdc1b7325d0c58c8f76f9"
  },
  "description": "ansi-regex builds the regular expression used across the npm ecosystem (chalk, strip-ansi, etc.) to match ANSI escape codes. Untrusted text containing a long run of \";\" after an escape introducer forces quadratic backtracking.",
  "references": [
    "https://nvd.nist.gov/vuln/detail/CVE-2021-3807",
    "https://github.com/advisories/GHSA-93q8-gq69-wqmw",
    "https://github.com/chalk/ansi-regex/commit/8d1d7cdb586269882c4bdc1b7325d0c58c8f76f9"
  ]
}
