{
  "id": "ua-parser-js-CVE-2021-27292",
  "name": "ua-parser-js",
  "type": "cve",
  "cve": "CVE-2021-27292",
  "ghsa": "GHSA-78cj-fxph-m83p",
  "cwe": "CWE-400",
  "ecosystem": "npm",
  "engine": "javascript",
  "package": "ua-parser-js",
  "affected": ">=0.7.14 <0.7.24",
  "patched": "0.7.24",
  "published": "2021-05-06",
  "discovered_by": "Doyensec",
  "regex": "]\\s+(Barnes[&\\s]+Noble\\s+|BN[RT])(V?.*)\\s+build",
  "flags": "i",
  "complexity": "quadratic",
  "attack": {
    "prefix": "] BNT",
    "pad": " ",
    "suffix": "x"
  },
  "benign": "] BNTV Nook build",
  "fix": {
    "type": "regex-rewrite",
    "summary": "One of the device-detection rules used `(V?.*)\\s+build` to capture a Barnes & Noble Nook model name. The greedy `.*` and the following `\\s+` both match spaces, so on a long run of spaces that is not terminated by the literal `build`, the engine repartitions the space run between `.*` and `\\s+` from every start offset: O(n^2). ua-parser-js 0.7.24 rewrote the capture as `(\\S(?:.*\\S)?)`, which forces the model name to start and end with a non-space character. That removes the overlap with the trailing `\\s+build`, so the match fails once and the scan is linear.",
    "commit": "https://github.com/faisalman/ua-parser-js/commit/809439e20e273ce0d25c1d04e111dcf6011eb566"
  },
  "description": "ua-parser-js parses browser/OS/device information out of User-Agent strings and is one of the most-depended-on packages in the npm ecosystem (a transitive dependency of a very large number of analytics and server-side libraries). One of its device-detection regexes, `(V?.*)\\s+build`, backtracks quadratically on a User-Agent value that reaches the Barnes & Noble branch and then contains a long run of whitespace with no trailing `build` token, because the greedy `.*` and the adjacent `\\s+` compete over the same space run.",
  "references": [
    "https://nvd.nist.gov/vuln/detail/CVE-2021-27292",
    "https://github.com/advisories/GHSA-78cj-fxph-m83p",
    "https://github.com/faisalman/ua-parser-js/commit/809439e20e273ce0d25c1d04e111dcf6011eb566"
  ]
}
