{
  "id": "debug-CVE-2017-16137",
  "name": "debug",
  "type": "cve",
  "cve": "CVE-2017-16137",
  "ghsa": "GHSA-gxpj-cx7g-858c",
  "cwe": "CWE-1333",
  "ecosystem": "npm",
  "engine": "javascript",
  "package": "debug",
  "affected": "<2.6.9 || >=3.0.0 <3.1.0 || >=3.2.0 <3.2.7 || >=4.0.0 <4.3.1",
  "patched": "3.1.0",
  "published": "2018-06-07",
  "discovered_by": "Cristian-Alexandru Staicu et al. (reported via Node Security)",
  "regex": "\\s*\\n\\s*",
  "flags": "g",
  "complexity": "quadratic",
  "attack": {
    "prefix": "",
    "pad": " ",
    "suffix": ""
  },
  "benign": " foo\n   bar\n baz ",
  "fix": {
    "type": "algorithm-change",
    "summary": "debug's `%o`/`%O` object formatter normalized the multi-line output of `util.inspect()` by collapsing newline-surrounding whitespace with `str.replace(/\\s*\\n\\s*/g, ' ')`. The two greedy `\\s*` groups on either side of `\\n` overlap: on a long run of whitespace that contains no newline, at every start offset the leading `\\s*` matches to the end of the run and then fails to find the required `\\n`, and the global search retries from the next offset, giving O(n^2) behaviour on attacker-influenced logged objects. debug 3.1.0 (commit c38a016) removed the regex entirely and replaced it with a linear `inspected.split('\\n').map(str => str.trim()).join(' ')`, producing the same normalization without backtracking.",
    "commit": "https://github.com/debug-js/debug/commit/c38a0166c266a679c8de012d4eaccec3f944e685"
  },
  "description": "debug is one of the most-downloaded packages in the entire npm ecosystem (a transitive dependency of Express, Mocha, and thousands of other tools). When a debug statement logs an object with the `%o` or `%O` formatter, the formatter runs `util.inspect()` and then collapses the resulting multi-line string with the regex `/\\s*\\n\\s*/g`. Because the whitespace groups on both sides of the newline overlap, a value whose inspected form contains a long whitespace run without a newline forces quadratic backtracking, letting attacker-controlled logged data stall the event loop. (The same bug is also tracked as CVE-2017-20165 / GHSA-9vvw-cc9w-f27h.)",
  "references": [
    "https://nvd.nist.gov/vuln/detail/CVE-2017-16137",
    "https://github.com/advisories/GHSA-gxpj-cx7g-858c",
    "https://github.com/debug-js/debug/pull/504",
    "https://github.com/debug-js/debug/commit/c38a0166c266a679c8de012d4eaccec3f944e685"
  ]
}
