{
  "id": "trim-newlines-CVE-2021-33623",
  "name": "trim-newlines",
  "type": "cve",
  "cve": "CVE-2021-33623",
  "ghsa": "GHSA-7p7h-4mm5-852v",
  "cwe": "CWE-1333",
  "ecosystem": "npm",
  "engine": "javascript",
  "package": "trim-newlines",
  "affected": "<3.0.1 || >=4.0.0 <4.0.1",
  "patched": "3.0.1",
  "published": "2021-05-31",
  "discovered_by": "Yeting Li",
  "regex": "[\\r\\n]+$",
  "flags": "",
  "complexity": "quadratic",
  "attack": {
    "prefix": "",
    "pad": "\n",
    "suffix": "!"
  },
  "benign": "hello world\n\n",
  "fix": {
    "type": "algorithm-change",
    "summary": "The `.end`/default trailing trim used `string.replace(/[\\r\\n]+$/, '')`. The end-anchored `[\\r\\n]+$` re-scans a long run of newline characters from every start position when the final character is not a newline, so the `$` never matches after the run: O(n^2). trim-newlines 3.0.1 (and 4.0.1) replaced the trailing regex with a plain character-scan loop that walks backwards over `\\r`/`\\n`, making the trim linear.",
    "commit": "https://github.com/sindresorhus/trim-newlines/commit/25246c6ce5eea1c82d448998733a6302a4350d91"
  },
  "description": "trim-newlines strips leading/trailing newlines from a string and is a widely-used transitive dependency (e.g. via meow, which backs a large number of CLI tools). Its trailing-trim regex `[\\r\\n]+$` backtracks quadratically on a long run of newline characters that ends in a non-newline character, since the end anchor fails after the greedy run at every start offset.",
  "references": [
    "https://nvd.nist.gov/vuln/detail/CVE-2021-33623",
    "https://github.com/advisories/GHSA-7p7h-4mm5-852v",
    "https://github.com/sindresorhus/trim-newlines/commit/25246c6ce5eea1c82d448998733a6302a4350d91"
  ]
}
