{
  "id": "cross-spawn-CVE-2024-21538",
  "name": "cross-spawn",
  "type": "cve",
  "cve": "CVE-2024-21538",
  "ghsa": "GHSA-3xgq-45jj-v275",
  "cwe": "CWE-1333",
  "ecosystem": "npm",
  "engine": "javascript",
  "package": "cross-spawn",
  "affected": ">=7.0.0 <7.0.5 || <6.0.6",
  "patched": "7.0.5",
  "published": "2024-11-08",
  "discovered_by": "reported via GitHub advisory GHSA-3xgq-45jj-v275",
  "regex": "(\\\\*)$",
  "flags": "",
  "complexity": "quadratic",
  "attack": {
    "prefix": "",
    "pad": "\\",
    "suffix": "!"
  },
  "benign": "\\\\\\\\",
  "fix": {
    "type": "regex-rewrite",
    "summary": "cross-spawn's Windows argument escaper in `lib/util/escape.js` doubled trailing backslashes with `arg.replace(/(\\*)$/, '$1$1')` (and doubled backslashes before a quote with `/(\\*)\"/g`). The group `(\\*)` greedily consumes a run of backslashes and, because the overall match is not anchored at the start, the engine retries the greedy-then-backtrack of `$` from every offset in the run: O(n^2) on a long backslash run that never satisfies the anchor. cross-spawn 7.0.5 / 6.0.6 rewrote both patterns to a lookahead form `/(?=(\\+?)?)\\1$/` that captures the run without a backtrackable greedy quantifier, making the scan linear.",
    "commit": "https://github.com/moxystudio/node-cross-spawn/commit/5ff3a07d9add449021d806e45c4168203aa833ff"
  },
  "description": "cross-spawn is one of the most-downloaded packages on npm (a transitive dependency of countless CLIs and build tools via its use inside `execa` and many others). When escaping command arguments for Windows in `lib/util/escape.js`, it doubled trailing backslashes with the regex `/(\\*)$/`. Because `(\\*)` greedily matches a run of backslashes and the pattern is not anchored at the start of the string, an argument consisting of a long run of backslash characters forces the engine to greedily consume the run, fail the `$` anchor, backtrack one backslash at a time, and then retry the whole match from each successive start offset: quadratic O(n^2) blow-up. Since argument strings can be attacker-influenced, this is a denial-of-service vector. cross-spawn 7.0.5 (and 6.0.6) replaced the greedy group with a backtracking-free lookahead `/(?=(\\+?)?)\\1$/`.",
  "references": [
    "https://nvd.nist.gov/vuln/detail/CVE-2024-21538",
    "https://github.com/advisories/GHSA-3xgq-45jj-v275",
    "https://github.com/moxystudio/node-cross-spawn/pull/160",
    "https://github.com/moxystudio/node-cross-spawn/commit/5ff3a07d9add449021d806e45c4168203aa833ff"
  ]
}
