{
  "id": "color-string-CVE-2021-29060",
  "name": "color-string",
  "type": "cve",
  "cve": "CVE-2021-29060",
  "ghsa": "GHSA-257v-vj4p-3w2h",
  "cwe": "CWE-1333",
  "ecosystem": "npm",
  "package": "color-string",
  "affected": "<1.5.5",
  "patched": "1.5.5",
  "published": "2021-04-05",
  "discovered_by": "Yeting Li",
  "regex": "^hwb\\(\\s*([+-]?\\d*[\\.]?\\d+)(?:deg)?\\s*,\\s*([+-]?[\\d\\.]+)%\\s*,\\s*([+-]?[\\d\\.]+)%\\s*(?:,\\s*([+-]?[\\d\\.]+)\\s*)?\\)$",
  "flags": "",
  "complexity": "quadratic",
  "attack": {
    "prefix": "hwb(",
    "pad": "1",
    "suffix": "!"
  },
  "benign": "hwb(120, 0%, 0%)",
  "fix": {
    "type": "regex-rewrite",
    "summary": "The HWB colour parser used ([+-]?\\d*[\\.]?\\d+) where \\d* and \\d+ overlap, so a long digit run followed by an invalid character backtracks quadratically. color-string 1.5.5 tightened the numeric group.",
    "commit": "https://github.com/Qix-/color-string/commit/79e4a469fb81f79cb9d3d7c7eb92adc7006aa71c"
  },
  "description": "color-string parses CSS colour strings and underlies the \"color\" package used throughout Node.js styling libraries. A malformed hwb() value with a long digit run triggers quadratic backtracking.",
  "references": [
    "https://nvd.nist.gov/vuln/detail/CVE-2021-29060",
    "https://github.com/advisories/GHSA-257v-vj4p-3w2h"
  ]
}
