{
  "id": "axios-CVE-2021-3749",
  "name": "axios",
  "type": "cve",
  "cve": "CVE-2021-3749",
  "ghsa": "GHSA-cph5-m8f7-6c5x",
  "cwe": "CWE-1333",
  "ecosystem": "npm",
  "engine": "javascript",
  "package": "axios",
  "affected": "<0.21.2",
  "patched": "0.21.2",
  "published": "2021-08-31",
  "discovered_by": "huntr.dev (bounty 1e8f07fc)",
  "regex": "\\s*$",
  "flags": "",
  "complexity": "quadratic",
  "attack": {
    "prefix": "x",
    "pad": " ",
    "suffix": "!"
  },
  "benign": "   hello world   ",
  "fix": {
    "type": "algorithm-change",
    "summary": "axios's internal `trim` helper stripped surrounding whitespace with `str.replace(/^\\s*/, '').replace(/\\s*$/, '')`. The end-anchored `\\s*$` re-scans a long run of whitespace from every start offset when the string ends in a non-whitespace character, so the `$` never matches after the greedy run: O(n^2). axios 0.21.2 replaced the helper with the native `String.prototype.trim()` (falling back to `str.replace(/^\\s+|\\s+$/g, '')`), making whitespace trimming linear.",
    "commit": "https://github.com/axios/axios/commit/5b457116e31db0e88fede6c428e969e87f290929"
  },
  "description": "axios is one of the most widely used HTTP clients in the JavaScript ecosystem. Its internal `trim` helper used the end-anchored regex `\\s*$` to strip trailing whitespace (applied to values such as response header lines). A long run of whitespace that ends in a non-whitespace character forces the greedy `\\s*` to match to the end of the run and then fail the `$` anchor at every start offset, producing quadratic backtracking on attacker-influenced input.",
  "references": [
    "https://nvd.nist.gov/vuln/detail/CVE-2021-3749",
    "https://github.com/advisories/GHSA-cph5-m8f7-6c5x",
    "https://huntr.dev/bounties/1e8f07fc-c384-4ff9-8498-0690de2e8c31",
    "https://github.com/axios/axios/commit/5b457116e31db0e88fede6c428e969e87f290929"
  ]
}
