{
  "id": "mime-CVE-2017-16138",
  "name": "mime",
  "type": "cve",
  "cve": "CVE-2017-16138",
  "ghsa": "GHSA-wrvr-8mpx-r7pp",
  "cwe": "CWE-400",
  "ecosystem": "npm",
  "package": "mime",
  "affected": "<1.4.1 || >=2.0.0 <2.0.3",
  "patched": "1.4.1",
  "published": "2018-05-31",
  "discovered_by": "Nick Starke",
  "regex": ".*[\\.\\/\\\\]",
  "flags": "",
  "complexity": "quadratic",
  "attack": {
    "prefix": "",
    "pad": "a",
    "suffix": ""
  },
  "benign": "file.txt",
  "fix": {
    "type": "algorithm-change",
    "summary": "mime.lookup() ran an unanchored /.*[./\\\\]/ over the whole path; with no separator present the greedy .* restarts at every offset (quadratic). mime 1.4.1 replaced the regex with a plain lastIndexOf scan.",
    "commit": "https://github.com/broofa/mime/commit/1df903fdeb9ae7eaa048795b8d580ce2c98f40b0"
  },
  "description": "The classic \"mime\" package resolves a file extension to a MIME type. mime.lookup() applied an unanchored greedy regex to the input path; a long extension-less filename forces quadratic scanning.",
  "references": [
    "https://nvd.nist.gov/vuln/detail/CVE-2017-16138",
    "https://github.com/advisories/GHSA-wrvr-8mpx-r7pp"
  ]
}
