{
  "id": "semver-CVE-2022-25883",
  "name": "node-semver",
  "type": "cve",
  "cve": "CVE-2022-25883",
  "ghsa": "GHSA-c2qf-rxjj-qqgw",
  "cwe": "CWE-1333",
  "ecosystem": "npm",
  "package": "semver",
  "affected": "<7.5.2",
  "patched": "7.5.2",
  "published": "2023-06-21",
  "discovered_by": "l0n3star",
  "regex": "^((?:<|>)?=?)\\s*[v=\\s]*(0|[1-9]\\d*|x|X|\\*)(?:\\.(0|[1-9]\\d*|x|X|\\*)(?:\\.(0|[1-9]\\d*|x|X|\\*)(?:(?:-((?:0|[1-9]\\d*|\\d*[a-zA-Z-][a-zA-Z0-9-]*)(?:\\.(?:0|[1-9]\\d*|\\d*[a-zA-Z-][a-zA-Z0-9-]*))*)))?(?:\\+([0-9A-Za-z-]+(?:\\.[0-9A-Za-z-]+)*))?)?)?$",
  "flags": "",
  "complexity": "quadratic",
  "attack": {
    "prefix": "",
    "pad": " ",
    "suffix": "!"
  },
  "benign": ">=1.2.3",
  "fix": {
    "type": "regex-rewrite",
    "summary": "The X-range token starts with `\\s*[v=\\s]*`, so a run of leading whitespace can be split between the two adjacent whitespace-matching groups in many ways; a trailing non-version character then fails the `$` anchor and forces quadratic backtracking over every split point. semver 7.5.2 trims and length-limits the range string before this regex ever runs.",
    "commit": "https://github.com/npm/node-semver/commit/717534ee353682f3bcf33e60a8af4292626d4441"
  },
  "description": "node-semver is npm's version-range parser and one of the most-depended-on packages in the ecosystem. Passing an attacker-controlled version or range string (e.g. via `new Range()`, `satisfies()` or `validRange()`) triggers quadratic backtracking in the X-range regex on an input that is mostly whitespace, stalling the event loop.",
  "references": [
    "https://nvd.nist.gov/vuln/detail/CVE-2022-25883",
    "https://github.com/advisories/GHSA-c2qf-rxjj-qqgw",
    "https://github.com/npm/node-semver/pull/564"
  ]
}
